{
  "taskId": "live-omo-validation-repair",
  "cwd": "/home/molt/clawd/.tmp/openclaw-fabric-live-sandbox-20260415-084226-lane-hardened3",
  "goal": "Repair attempt for live-omo-validation.\nClassification: empty_turn_or_noncompliant_completion.\nPrevious OMO session id: ses_26e9eeaffffeTWyQHOolx1gJGR.\nThe previous run completed without writing all required artifacts.\nDo not summarize the missing work. Actually write the required artifacts now.\nTranscript snippet from the prior session:\n```text\nsession_id=ses_26e9eeaffffeTWyQHOolx1gJGR\nexit_code=0\nstdout:\ndata\n{\"role\":\"user\",\"time\":{\"created\":1776260552213},\"tools\":{\"question\":false},\"agent\":\"​Sisyphus - Ultraworker\",\"model\":{\"providerID\":\"openclawraw\",\"modelID\":\"openclaw/sable-opus-46\"},\"summary\":{\"diffs\":[]}}\n{\"parentID\":\"msg_d91611615001quDdl2y6RPuc6A\",\"role\":\"assistant\",\"mode\":\"​Sisyphus - Ultraworker\",\"agent\":\"​Sisyphus - Ultraworker\",\"path\":{\"cwd\":\"/home/molt/clawd/.tmp/openclaw-fabric-live-sandbox-20260415-084226-lane-hardened3\",\"root\":\"/home/molt/clawd\"},\"cost\":0,\"tokens\":{\"input\":0,\"output\":0,\"reasoning\":0,\"cache\":{\"write\":0,\"read\":0}},\"modelID\":\"openclaw/sable-opus-46\",\"providerID\":\"openclawraw\",\"time\":{\"created\":1776260552281,\"completed\":1776260557396},\"finish\":\"other\"}\nstderr:\n<empty>\n```\n\nOriginal task goal:\nRead inputs/source.txt. Write artifacts/live-handoff.md with what was done, what remains unresolved, and verification performed. Write artifacts/live-result.json matching the declared WorkerResult contract with status succeeded if both artifacts are written.",
  "inputs": [
    "/home/molt/clawd/.tmp/openclaw-fabric-live-sandbox-20260415-084226-lane-hardened3/inputs/source.txt"
  ],
  "writeArtifacts": {
    "handoff": "/home/molt/clawd/.tmp/openclaw-fabric-live-sandbox-20260415-084226-lane-hardened3/artifacts/live-handoff.md",
    "result": "/home/molt/clawd/.tmp/openclaw-fabric-live-sandbox-20260415-084226-lane-hardened3/artifacts/live-result.json"
  },
  "stopCondition": "Both declared artifacts exist and the result JSON validates.",
  "verify": [
    "handoff artifact exists",
    "result artifact conforms to worker-result.schema.json shape"
  ],
  "resumeFrom": "/home/molt/clawd/.tmp/openclaw-fabric-live-sandbox-20260415-084226-lane-hardened3/ses_26e9eeaffffeTWyQHOolx1gJGR"
}
